{
  "color": {
    "bg": { "light": "#faf8f5", "dark": "#171311", "use": "The page" },
    "surface": { "light": "#ffffff", "dark": "#211b18", "use": "A card" },
    "sunken": { "light": "#f2ede6", "dark": "#1c1613", "use": "A quiet band behind cards" },
    "ink": { "light": "#2a211d", "dark": "#f3ede6", "use": "Text" },
    "ink-2": { "light": "#5b4c45", "dark": "#c2b5aa", "use": "Secondary text" },
    "ink-3": { "light": "#74665e", "dark": "#a1948a", "use": "Captions and labels" },
    "line": { "light": "rgba(42, 33, 29, 0.12)", "dark": "rgba(243, 237, 230, 0.12)", "use": "A hairline border" },
    "brand": { "light": "#674a40", "dark": "#d9b8a6", "use": "The Junto brown, for the wordmark" },
    "accent": { "light": "#1f6f70", "dark": "#7fd0d1", "use": "Links, focus and the primary button" },
    "accent-strong": { "light": "#14494a", "dark": "#a9e3e4", "use": "A link or a button on hover" },
    "accent-soft": { "light": "rgba(31, 111, 112, 0.14)", "dark": "rgba(127, 208, 209, 0.18)", "use": "Focus ring and the target highlight" },
    "on-accent": { "light": "#ffffff", "dark": "#0c1f1f", "use": "Text on the accent colour" },
    "image-outline": { "light": "oklch(0 0 0 / 0.1)", "dark": "oklch(1 0 0 / 0.1)", "use": "A 1 px outline on an image" },
    "glow-tint": { "light": "rgba(31, 111, 112, 0.16)", "dark": "rgba(127, 208, 209, 0.2)", "use": "The light that follows the pointer on a card or a quiet button" },
    "glow-on-accent": { "light": "rgba(255, 255, 255, 0.3)", "dark": "rgba(255, 255, 255, 0.34)", "use": "The same light on the primary button" },
    "sheen": { "light": "rgba(255, 255, 255, 0.9)", "dark": "rgba(255, 255, 255, 0.8)", "use": "The light that circles the main button" }
  },
  "shadow": {
    "shadow-card": { "light": "0 1px 2px rgba(42, 33, 29, 0.06), 0 12px 32px -20px rgba(42, 33, 29, 0.3)", "dark": "0 1px 2px rgba(0, 0, 0, 0.4), 0 12px 32px -20px rgba(0, 0, 0, 0.7)", "use": "A card lifted from the page" },
    "shadow-lift": { "light": "0 2px 4px rgba(42, 33, 29, 0.05), 0 28px 48px -26px rgba(42, 33, 29, 0.32)", "dark": "0 2px 4px rgba(0, 0, 0, 0.45), 0 28px 48px -26px rgba(0, 0, 0, 0.75)", "use": "A card on hover, lifted a little higher and softer" },
    "shadow-raise": { "light": "inset 0 1px 0 rgba(255, 255, 255, 0.9), 0 1px 2px rgba(42, 33, 29, 0.08), 0 0 0 1px rgba(42, 33, 29, 0.04)", "dark": "inset 0 1px 0 rgba(255, 255, 255, 0.06), 0 1px 2px rgba(0, 0, 0, 0.5), 0 0 0 1px rgba(255, 255, 255, 0.03)", "use": "A quiet button: edge light on top, a ring and a small drop" },
    "shadow-raise-accent": { "light": "inset 0 1px 0 rgba(255, 255, 255, 0.28), inset 0 -1px 0 rgba(0, 0, 0, 0.18), 0 1px 2px rgba(20, 73, 74, 0.4), 0 10px 20px -10px rgba(31, 111, 112, 0.55)", "dark": "inset 0 1px 0 rgba(255, 255, 255, 0.4), inset 0 -1px 0 rgba(0, 0, 0, 0.2), 0 1px 2px rgba(0, 0, 0, 0.5), 0 10px 22px -10px rgba(127, 208, 209, 0.4)", "use": "The primary button: the same edge light and a colored drop" },
    "shadow-header": { "light": "0 10px 24px -18px rgba(42, 33, 29, 0.3)", "dark": "0 10px 24px -18px rgba(0, 0, 0, 0.7)", "use": "The header after the page scrolls" }
  },
  "fixed": {
    "radius-xs": "6px",
    "radius-sm": "10px",
    "radius-md": "14px",
    "radius-lg": "22px",
    "radius-pill": "999px",
    "space-1": "4px",
    "space-2": "8px",
    "space-3": "12px",
    "space-4": "16px",
    "space-5": "24px",
    "space-6": "32px",
    "space-7": "48px",
    "space-8": "64px",
    "space-9": "96px",
    "gutter": "clamp(16px, 5vw, 32px)",
    "shell": "72rem",
    "section-gap": "clamp(72px, 10vw, 120px)",
    "grid-12": "repeat(12, minmax(0, 1fr))",
    "touch": "44px",
    "action-min": "12.5rem",
    "font-sans": "\"Inter\", system-ui, -apple-system, \"Segoe UI\", Roboto, sans-serif",
    "text-2xs": "0.6875rem",
    "text-xs": "0.75rem",
    "text-sm": "0.875rem",
    "text-md": "1rem",
    "text-lg": "1.125rem",
    "text-xl": "1.25rem",
    "title-3": "clamp(1.375rem, 1.25rem + 0.5vw, 1.625rem)",
    "title-2": "clamp(1.75rem, 1.35rem + 1.7vw, 2.625rem)",
    "title-1": "clamp(2.375rem, 1.5rem + 4.4vw, 4.5rem)",
    "motion-fast": "0.15s",
    "motion-base": "0.2s",
    "motion-enter": "0.3s",
    "motion-reveal": "0.55s",
    "motion-stagger": "70ms",
    "ease-out": "cubic-bezier(0.23, 1, 0.32, 1)",
    "ease-icon": "cubic-bezier(0.2, 0, 0, 1)",
    "ease-reveal": "cubic-bezier(0.22, 1, 0.36, 1)",
    "reveal-distance": "12px",
    "glow-size": "220px",
    "motion-glow": "0.4s",
    "motion-follow": "0.22s",
    "sheen-duration": "6s",
    "shimmer-duration": "7s"
  },
  "pairs": [
    { "text": "ink", "on": "bg", "min": 4.5 },
    { "text": "ink", "on": "surface", "min": 4.5 },
    { "text": "ink-2", "on": "bg", "min": 4.5 },
    { "text": "ink-2", "on": "surface", "min": 4.5 },
    { "text": "ink-3", "on": "bg", "min": 4.5 },
    { "text": "ink-3", "on": "surface", "min": 4.5 },
    { "text": "ink", "on": "sunken", "min": 4.5 },
    { "text": "ink-2", "on": "sunken", "min": 4.5 },
    { "text": "ink-3", "on": "sunken", "min": 4.5 },
    { "text": "accent", "on": "sunken", "min": 4.5 },
    { "text": "brand", "on": "bg", "min": 4.5 },
    { "text": "accent", "on": "bg", "min": 4.5 },
    { "text": "accent", "on": "surface", "min": 4.5 },
    { "text": "accent", "on": "sunken", "min": 4.5 },
    { "text": "accent-strong", "on": "bg", "min": 4.5 },
    { "text": "on-accent", "on": "accent", "min": 4.5 }
  ]
}
